{
    "type": "scope",
    "id": "TOPDESKBV/MSI",
    "name": "topdeskbv/msi",
    "accessPackages": {
        "production": "EM4W-DATA-schemascope-p-scope_topdeskbv_msi",
        "nonProduction": "EM4W-DATA-schemascope-ot-scope_topdeskbv_msi"
    },
    "owner": {
        "$ref": "publishers/AMID"
    }
}
