{
  "type": "scope",
  "id": "KLACHTENAFHANDELINGDVL",
  "name": "Klachtenafhandeling Dienstverlening",
  "accessPackages": {
    "nonProduction": "EM4W-DATA-schemascope-ot-scope_klachtenafhandelingdvl",
    "production": "EM4W-DATA-schemascope-p-scope_klachtenafhandelingdvl"
  },
  "owner": {
    "$ref": "publishers/SVD"
  }
}
