{
  "type": "scope",
  "id": "JURIDISCHBUREAUSOCIAAL",
  "name": "Juridisch Bureau Sociaal",
  "accessPackages": {
    "nonProduction": "EM4W-DATA-schemascope-ot-scope_juridischbureausociaal",
    "production": "EM4W-DATA-schemascope-p-scope_juridischbureausociaal"
  },
  "owner": {
    "$ref": "publishers/SVD"
  }
}
